titulo,estatus,tiempo_de_publicado,publicado_por,denominacion,precio,metros_totales,recamaras,banos,Cantidad de pisos:,Asador:,Estacionamientos:,Con condominio cerrado:,Jardin:,Alberca:,Antiguedad:,ubicacion,descripcion,url
Cabana En Venta En Tepalzingo Hidalgo,Casa en Venta,Publicado hace 3 meses,Inmobiliaria con identidad verificada,$,"2,500,000",4600 m2 totales,2 recamaras,2 banos,0,No,4,sin dato,No,No,10 anos,"Carr. Tulancingo-huachinango, Tepalzingo, Tulancingo De Bravo, Hidalgo","$2,500,000 VENTA4,600 m2 de terreno180m2 de construccion 2 recamaras con bano2 banosChimenea Cocina integralEspacio para salaComedorCuenta con servicio de agua y luz1 tinaco de 5,000lts1 tinaco de 1,000ltsSe encuentra a frente a crucero de Pahuatlan y a 15 min de un balneario y de AcaxochitlanUbicacion: https://goo.gl/maps/V335o4LHmyHNoL7a8",https://casa.mercadolibre.com.mx/MLM-3056633602-cabana-en-venta-en-tepalzingo-hidalgo-_JM#position%3D40%26search_layout%3Dgrid%26type%3Ditem%26tracking_id%3D9271960c-4ea8-44c2-acdf-5289d69ca8f6
"Preventa De Casa De 3 Recamaras En Medias Tierras, Tualancingo",Casa en Venta,Publicado hace 25 dias,Inmobiliaria con identidad verificada,$,"1,800,000",105 m2 totales,3 recamaras,1 bano,2,sin dato,2,sin dato,sin dato,sin dato,0 anos,"Plan De Ayala, Tulancingo De Bravo, Hidalgo","La colonia Medias Tierras, cuenta con todos los servicios de luz, agua, drenaje, cable, internet;es un lugar tranquilo para estar con tu familia. Esta a solo 8minutos del centro de la ciudad, a sus alrededores tiene escuelas publicas y privadas de educacion basica, preparatoria y universidad de la UAEH, tiendas locales, farmacias, papelerias, tiendas de autoservicio, gasolineras, salones de fiesta, restaurantes, canchas deportivas, transporte publico a pie de carretera a Tulancingo, Santiago, Cuautepec.La casa cuenta con:-Planta baja:CocinaComedorMedio banoÁrea de servicioCochera para dos autos con reja  -Planta alta:3 habitacionesUn bano completoÁrea para vestidor-Amenidades:CisternaEscaleras para roof gardenPregunta por la forma de pago.DISPONIBILIDAD Y PRECIO SUJETO A CAMBIOS Y/O VARIACIONES SIN PREVIO AVISO*El precio no incluye gastos de escrituracion, gastos administrativos e impuestos.Horario de atencion para citasLunes a viernes: 10:00 a 14:00 y 16:30 a 18:00Sabados: 10:00 a 14:30Domingos: previa citaMayores informes y citas: 7757533901HAY UN LUGAR ESPERANDO SER TU HOGAR",https://casa.mercadolibre.com.mx/MLM-3261690224-preventa-de-casa-de-3-recamaras-en-medias-tierras-tualancingo-_JM#position%3D41%26search_layout%3Dgrid%26type%3Ditem%26tracking_id%3D9271960c-4ea8-44c2-acdf-5289d69ca8f6
"Casa Residencial 1 Piso En Pedregal San Francisco, Tulancingo",Casa en Venta,Publicado hace 34 dias,Inmobiliaria con identidad verificada,$,"15,000,000",1100 m2 totales,3 recamaras,3 banos,1,sin dato,2,sin dato,Si,Si,0 anos,"Tulancingo De Bravo, Hidalgo",Casa en Tulancingo Fraccionamiento Residencial San Francisco Terreno 1100 mConstruccion 400 mDistribucion Casa muy amplia de un nivel Recibidor SalaComedor con chimenea Cocina integral Area de lavado 3 recamaras 3 banos completos Dos areas grandes de jardin Area de camastros Alberca interior techada con equipo paneles solares y caldera Madera de caoba puertas estilo italiano,https://casa.mercadolibre.com.mx/MLM-2102485527-casa-residencial-1-piso-en-pedregal-san-francisco-tulancingo-_JM#position%3D42%26search_layout%3Dgrid%26type%3Ditem%26tracking_id%3D9271960c-4ea8-44c2-acdf-5289d69ca8f6
"Proyecto De Casa En Privada Residencial, Tulancingo Hidalgo",Casa en Venta,Publicado hace 5 meses,Inmobiliaria con identidad verificada,$,"2,650,000",202 m2 totales,3 recamaras,2 banos,1,sin dato,2,sin dato,Si,sin dato,0 anos,"Tulancingo De Bravo, Hidalgo","PROYECTO DE CASAResidencial Terranova es una zona con excelente plusvalia, gracias a su ubicacion tiene cerca bancos, escuelas, central de autobuses, hospitales, avenidas importantes de Tulancingo y esta cerca de la Plaza del Vestido.Al ser un proyecto de casa en construccion, se tiene la ventaja de supervisar la obra; asi como de elegir colores de pisos, azulejos, puertas, cocina; asi como si se desea hacer alguna adecuacion personal.La casa cuenta con:3 recamaras.Recamara principal con bano.Sala-comedor.Cocina integral con barra desayunador.Jardin interior.Cuarto de lavado.Garaje 2 autos.Cisterna de 8,500 lts.Roof garden iluminado con asador.DISPONIBILIDAD Y PRECIO SUJETO A CAMBIOS Y/O VARIACIONES SIN PREVIO AVISO*El precio no incluye gastos de escrituracion, gastos administrativos e impuestos.Horario de atencion para citasLunes a viernes: 10:00 a 14:00 y 16:30 a 18:00Sabados: 10:00 a 14:30Domingos: previa citaMayores informes y citas: 7757533901HAY UN LUGAR ESPERANDO SER TU HOGAR",https://casa.mercadolibre.com.mx/MLM-2914829964-proyecto-de-casa-en-privada-residencial-tulancingo-hidalgo-_JM#position%3D43%26search_layout%3Dgrid%26type%3Ditem%26tracking_id%3D9271960c-4ea8-44c2-acdf-5289d69ca8f6
Oportunidad Venta De Casa En Recuperacion  Bancaria Cad,Casa en Venta,Publicado hace 4 meses,Inmobiliaria con identidad verificada,$,"1,179,800",70 m2 totales,3 recamaras,1 bano,2202,No,1,No,No,No,25 anos,"Calle Obsidiana, Lomas de Progreso, Tulancingo De Bravo, Hidalgo","¿BUSCAS INVERTIR?Una casa siempre es una excelente opcion para obtener altos rendimientos con bajo riesgo.¿Quieres hacer crecer tu patrimonio?, ¿Cansado de pagar renta?No esperes hasta tu vejez para conseguir casa propia piensa en grande y Atrevete a dar el siguiente paso.Propiedad de recuperacion hipotecaria con privilegiada ubicacion y servicios cercanos.Esta es una gran oportunidad para invertir en tu proxima propiedad con los mejores precios del ramo inmobiliario.¡NO SE ACEPTAN CRÉDITOS!La adquisicion es con recursos propios el precio y la disponibilidad estan sujetas a cambios y pueden variar.MAYORES INFORMES DEJE SU MENSAJELUIS CARLOS DAVILA ¡ ATENCION!  NO SE DEJE ENGAÑAR POR FALSOS ANUNCIOS TODAS NUESTRAS RECUPERACIONES SON COMPROBABLES",https://casa.mercadolibre.com.mx/MLM-2051466695-oportunidad-venta-de-casa-en-recuperacion-bancaria-cad-_JM#position%3D44%26search_layout%3Dgrid%26type%3Ditem%26tracking_id%3D9271960c-4ea8-44c2-acdf-5289d69ca8f6
Hermosa Casa En Remate,Casa en Venta,Publicado hace 43 dias,Inmobiliaria con identidad verificada,$,"2,500,000",228.5 m2 totales,4 recamaras,2 banos,2,sin dato,3,sin dato,Si,sin dato,14 anos,"C. Franz Von Liszt 101, Jardines Del Sur 3a Secc., Tulancingo De Bravo, Hidalgo","¡¡¡CUMPLE TU SUEÑO DE TENER TU PROPIA CASA/DEPARTAMENTO O INVIERTE EN UNO DE LOSMERCADOS MÁS SEGUROS, BIENES RAICES!!!En un lapso de maximo 2 anos y a menos de la mitad de su valor tendras tu propio patrimonio.Todo con la seguridad de un contrato certificado.Solo requieres tener la liquidez al momento (NO ACEPTAMOS CREDITOS, todo es con recursospropios).¡¡¡ESTA ES TU OPORTUNIDAD!!!Tambien contamos con propiedades de cesion inmediata y adjudicadas.¡Aprovecha y llama YA!",https://casa.mercadolibre.com.mx/MLM-2096618769-hermosa-casa-en-remate-_JM#position%3D45%26search_layout%3Dgrid%26type%3Ditem%26tracking_id%3D9271960c-4ea8-44c2-acdf-5289d69ca8f6
"Casa Economica En Napateco, Bienvenidos Creditos Hipotecarios",Casa en Venta,Publicado hace 5 meses,Inmobiliaria con identidad verificada,$,"740,000",92 m2 totales,2 recamaras,1 bano,1,No,1,No,No,No,0 anos,"Napateco, Tulancingo De Bravo, Hidalgo","Casaen venta en Napateco, Fraccionamiento Los Arcos.La colonia cuenta con todos los servicios, en la zona encontraras tiendas, establecimientos de comida, farmacias, Oxxo, gasolinera, espacios para realizar ejercicio al aire libre, parque para los pequenos de tu hogar, canchas para practicar algun deporte, guarderias, escuelas de nivel basico, universidad a solo 10 minutos de la colonia. El centro de Tulancingo esta a solo 15 minutos de Napateco, cuenta con transporte directo a la colonia.La casa de 1 nivel cuenta con:Sala-comedor.Cocina forrada de azulejo y opcion poner barra.1 bano completo forrado de azulejo.2 recamaras.Patio de servicio con proteccion en techo.Cochera para un auto.Amenidades:Construccion tradicional.Cimentacion de piedra, para 2do nivel.Ladrillo.Losa maciza.Boiler instantaneo (ahorro un 40% de gas)Se encuentran en construccion, se entregan completamente terminadas.BIENVENIDOS CRÉDITOS HIPOTECARIOS: INFONAVIT, FOVISSSTE, BANCARIO, CFE, ISSFAM, IMSSDISPONIBILIDAD Y PRECIO SUJETO A CAMBIOS Y/O VARIACIONES SIN PREVIO AVISO*El precio no incluye gastos de escrituracion, gastos administrativos e impuestos.Horario de atencion para citasLunes a viernes: 10:00 a 14:00 y 16:30 a 18:00Sabados: 10:00 a 14:30Domingos: previa citaMayores informes y citas: 7757533901HAY UN LUGAR ESPERANDO SER TU HOGAR",https://casa.mercadolibre.com.mx/MLM-2028431361-casa-economica-en-napateco-bienvenidos-creditos-hipotecarios-_JM#position%3D46%26search_layout%3Dgrid%26type%3Ditem%26tracking_id%3D9271960c-4ea8-44c2-acdf-5289d69ca8f6
Casa En San Jose,Casa en Venta,Publicado hace 28 dias,Inmobiliaria con identidad verificada,$,"1,250,000",120 m2 totales,3 recamaras,2 banos,sin dato,sin dato,0,sin dato,sin dato,sin dato,0 anos,"Tulancingo De Bravo, Hidalgo","Por su ubicacion en la zona tienes acceso a la carretera federal Mexico-Tuxpan y Pachuca- Tulancingo, se ubica a solo 10 minutos del centro de Tulancingo. A 5 minutos de Plaza Patio, donde encontrarastiendas departamentales, bancos de todas las instituciones, MEGA SORIANA, restaurantes, cine, agencias de viajes, Office Depot, etc.Acceso rapido a hospitales y clinicas privadas, escuelas publicas y privadas de nivel basico, media superior y superior. La colonia tiene servicios de luz, agua, drenaje, internet, transporte publico.La casa cuenta con:Cocina.Sala-comedor.2 banos3 recamarasPatio de servicio.Estacionamiento para 1 auto.Pregunta por la forma de pago.DISPONIBILIDAD Y PRECIO SUJETO A CAMBIOS Y/O VARIACIONES SIN PREVIO AVISO*El precio no incluye gastos de escrituracion, gastos administrativos e impuestos.Horario de atencion para citasLunes a viernes: 10:00 a 14:00 y 16:30 a 18:00Sabados: 10:00 a 14:30Domingos: previa citaMayores informes y citas: 7757533901HAY UN LUGAR ESPERANDO SER TU HOGAR",https://casa.mercadolibre.com.mx/MLM-3254643100-casa-en-san-jose-_JM#position%3D47%26search_layout%3Dgrid%26type%3Ditem%26tracking_id%3D9271960c-4ea8-44c2-acdf-5289d69ca8f6
Casa Con 3 Recamaras,Casa en Venta,Publicado hace 7 dias,Particular con identidad verificada,$,"2,150,000",105 m2 totales,3 recamaras,2 banos,sin dato,sin dato,0,sin dato,sin dato,sin dato,sin dato,"Andres De Olmos Esq. 5 De Febrero Sn, Rinconcito Colonial, Tulancingo De Bravo, Hidalgo","Estado habitable, zona centrica, a un costado de la ciclovia, cerca del seminario",https://casa.mercadolibre.com.mx/MLM-3306900740-casa-con-3-recamaras-_JM#position%3D48%26search_layout%3Dgrid%26type%3Ditem%26tracking_id%3D9271960c-4ea8-44c2-acdf-5289d69ca8f6
Residencia Con Alberca Techada 1 Sola Planta,Casa en Venta,Publicado hace 3 meses,Particular con identidad verificada,$,"2,799,999",600 m2 totales,2 recamaras,2 banos,1,sin dato,6,sin dato,Si,Si,5 anos,"Rubi Sn, San Isidro, Tulancingo De Bravo, Hidalgo","Residencia de 600 metros JardinUna sola planta 2 recamaras 2 banos completos Pasillo de cristal de la alberca a la casaAlberca techada de 20 metros de largo X 3 de ancho a 28-32 grados, con iluminacion interna para nadar a cualquier hora. Uso deportivo y familiar. 1.30 de profunidad Estacionamiento techado, para 6 autos Sistema solarPaga $56 mensuales de luz en general (incluido con calentador de alberca) 4 postes con lamparas led iluminando toda la calle AlarmaCamaras Todos los papeles en regla Edad - 5 anos",https://casa.mercadolibre.com.mx/MLM-2114208355-residencia-con-alberca-techada-1-sola-planta-_JM#position%3D1%26search_layout%3Dgrid%26type%3Ditem%26tracking_id%3D9271960c-4ea8-44c2-acdf-5289d69ca8f6
"Preventa Casa En Privada, Col Magisterio, Tulancingo Hidalgo",Casa en Venta,Publicado hace 3 dias,Inmobiliaria con identidad verificada,$,"1,450,000",143 m2 totales,4 recamaras,2 banos,2,sin dato,2,sin dato,sin dato,sin dato,1 anos,"Magisterio, Tulancingo De Bravo, Hidalgo","CASA NUEVA EN MAGISTERIO 1, TULANCINGO, HGO.La privada consta de 40 casas, calles pavimentadas de concreto, servicios ocultos, porton automatico; la zona cuenta con escuelas, tiendas de conveniencia, farmacias, a 3 minutos de plaza patio Tulancingo, a 7 min del centro de Tulancingo, acceso rapido a la carretera federal Mexico-Tuxpan.La casa cuenta con:Planta baja:Cocina.Comedor.Sala.1/2 bano.Estudio o recamara.Patio de servicio.Cisterna 12 mil litrosEstacionamiento para 2 autos.Planta alta:Recamara principal con bano completo independiente2 recamaras secundariasBano completoPregunta por la forma de pago.DISPONIBILIDAD Y PRECIO SUJETO A CAMBIOS Y/O VARIACIONES SIN PREVIO AVISO*El precio no incluye gastos de escrituracion, gastos administrativos e impuestos.Horario de atencion para citasLunes a viernes: 10:00 a 14:00 y 16:30 a 18:00Sabados: 10:00 a 14:30Domingos: previa citaMayores informes y citas: 7757533901HAY UN LUGAR ESPERANDO SER TU HOGAR",https://casa.mercadolibre.com.mx/MLM-3315454612-preventa-casa-en-privada-col-magisterio-tulancingo-hidalgo-_JM#position%3D2%26search_layout%3Dgrid%26type%3Ditem%26tracking_id%3D9271960c-4ea8-44c2-acdf-5289d69ca8f6
"Casa En Venta En Av. De Las Fuentes, La Morena, Tulancingo, Hidalgo - Recuperacion (ra)",Casa en Venta,Publicado hace 7 dias,Inmobiliaria con identidad verificada,$,"1,148,000",140 m2 totales,3 recamaras,2 banos,2,sin dato,0,sin dato,sin dato,sin dato,1 anos,"De Las Fuentes 1005, La Morena, Tulancingo De Bravo, Hidalgo","Aprovecha esta oportunidad y tomala... un gran beneficio te espera.Adquiere tu proxima propiedad con unos sencillos pasos:1.- Contactame para Asesorarte y explicarte con mas detalle el proceso 2.-Concreta una cita en nuestras Oficinas 3.-Adquiere tu Propiedad No esperes mas, ¡tu nueva Casa es una Realidad!Asesor Inmobiliario- Rodrigo Alegria",https://casa.mercadolibre.com.mx/MLM-3309363708-casa-en-venta-en-av-de-las-fuentes-la-morena-tulancingo-hidalgo-recuperacion-ra-_JM#position%3D3%26search_layout%3Dgrid%26type%3Ditem%26tracking_id%3D9271960c-4ea8-44c2-acdf-5289d69ca8f6
"Casa En Venta En Tulancingo, Hidalgo",Casa en Venta,Publicado hace 4 dias,Inmobiliaria con identidad verificada,$,"1,148,000",140 m2 totales,3 recamaras,2 banos,1148000,sin dato,2,sin dato,sin dato,sin dato,24 anos,"De Las Fuentes, La Morena, Tulancingo De Bravo, Hidalgo","¡Oportunidad Única! ¿Buscas una propiedad a excelente precio? ¡Esta es tu oportunidad! Tenemos a la venta casa en recuperacion hipotecaria que podrias adquirir a un precio realmente atractivo.Es una oportunidad perfecta para quienes buscan una buena inversion o su nuevo hogar.*Se usan recursos propios, no se aceptan creditos hipotecarios.Si estas interesado o quieres mas informacion, no dudes en contactarnos.Contacto: Lic. Neyva MontesCel. 442 239 1830¡No dejes pasar esta oportunidad!",https://casa.mercadolibre.com.mx/MLM-2122172989-casa-en-venta-en-tulancingo-hidalgo-_JM#position%3D4%26search_layout%3Dgrid%26type%3Ditem%26tracking_id%3D9271960c-4ea8-44c2-acdf-5289d69ca8f6
Casa Nueva De 3 Recamaras En San Isidro,Casa en Venta,Publicado hace 7 dias,Inmobiliaria con identidad verificada,$,"1,380,000",100 m2 totales,3 recamaras,2 banos,2,sin dato,1,sin dato,sin dato,sin dato,0 anos,"Tulancingo De Bravo, Hidalgo","La casa de dos nivelesubicada en San Isidro a solo 16 minutos del centro de Tulancingo y a 8 minutos del centro de Santiago Tulantepec. La colonia cuenta con servicios de luz, agua, drenaje, tiendas de primera necesidad,transporte publico.-Planta baja:Cocina concocinetaComedorSala1 recamara1 bano completoPatio de servicioCochera para1 auto-Planta alta:2 Recamaras amplias1 Bano completo-Amenidades:Cisterna de 5mil litros-Se entrega impermializadoPregunta por la forma de pagoDISPONIBILIDAD Y PRECIO SUJETO A CAMBIOS Y/O VARIACIONES SIN PREVIO AVISO*El precio no incluye gastos de escrituracion, gastos administrativos e impuestos.Horario de atencion para citasLunes a viernes: 10:00 a 14:00 y 16:30 a 18:00Sabados: 10:00 a 14:30Domingos: previa citaMayores informes y citas: 7757533901HAY UN LUGAR ESPERANDO SER TU HOGAR",https://casa.mercadolibre.com.mx/MLM-2119747627-casa-nueva-de-3-recamaras-en-san-isidro-_JM#position%3D5%26search_layout%3Dgrid%26type%3Ditem%26tracking_id%3D9271960c-4ea8-44c2-acdf-5289d69ca8f6
"Casa En Preventa En Privada, Medias Tierras Tulancingo",Casa en Venta,Publicado hace 1 dia,Inmobiliaria con identidad verificada,$,"1,800,000",160 m2 totales,3 recamaras,2 banos,2,sin dato,2,sin dato,sin dato,sin dato,0 anos,"Medias Tierras, Tulancingo De Bravo, Hidalgo",El vendedor no incluyo una descripcion del inmueble.,https://casa.mercadolibre.com.mx/MLM-2124214605-casa-en-preventa-en-privada-medias-tierras-tulancingo-_JM#position%3D6%26search_layout%3Dgrid%26type%3Ditem%26tracking_id%3D9271960c-4ea8-44c2-acdf-5289d69ca8f6
Casa Nueva En Cima Dorada. Bienvenidos Creditos Hipotecarios,Casa en Venta,Publicado hace 4 dias,Inmobiliaria con identidad verificada,$,"990,000",105 m2 totales,2 recamaras,1 bano,1,sin dato,1,sin dato,sin dato,sin dato,0 anos,"Cima Dorada, Tulancingo De Bravo, Hidalgo","El fraccionamiento Cima Dorada cuenta con 2 accesos con caseta de vigilancia, pista para caminatas, area de asadores, cancha de basquetbol y area de juegos para ninos.Ubicado a tan solo 5 minutos del centro de la cuidad,a un costado de la zona Arqueologica de Huapalcalco, muy cerca de clinicas medicas, hospitales, escuelas, establecimientos comerciales, central de autobuses, transporte publico a una cuadra.La casa esta distribuida en un nivel con:Sala.Comedor.Cocina1 Bano completo.2 Recamaras.Patio de servicio.Cochera para 1 vehiculos.Pregunta por la forma de pago.DISPONIBILIDAD Y PRECIO SUJETO A CAMBIOS Y/O VARIACIONES SIN PREVIO AVISO*El precio no incluye gastos de escrituracion, gastos administrativos e impuestos.Horario de atencion para citasLunes a viernes: 10:00 a 14:00 y 16:30 a 18:00Sabados: 10:00 a 14:30Domingos: previa citaMayores informes y citas: 7757533901HAY UN LUGAR ESPERANDO SER TU HOGAR",https://casa.mercadolibre.com.mx/MLM-2122232883-casa-nueva-en-cima-dorada-bienvenidos-creditos-hipotecarios-_JM#position%3D7%26search_layout%3Dgrid%26type%3Ditem%26tracking_id%3D9271960c-4ea8-44c2-acdf-5289d69ca8f6
Promocion Precio Solo Pago De Contado,Casa en Venta,Publicado hace 3 dias,Inmobiliaria con identidad verificada,$,"690,000",92 m2 totales,2 recamaras,1 bano,1,sin dato,1,sin dato,sin dato,sin dato,0 anos,"Napateco, Tulancingo De Bravo, Hidalgo","Casaen venta en Napateco, Fraccionamiento Los Arcos.La colonia cuenta con todos los servicios, en la zona encontraras tiendas, establecimientos de comida, farmacias, Oxxo, gasolinera, espacios para realizar ejercicio al aire libre, parque para los pequenos de tu hogar, canchas para practicar algun deporte, guarderias, escuelas de nivel basico, universidad a solo 10 minutos de la colonia. El centro de Tulancingo esta a solo 15 minutos de Napateco, cuenta con transporte directo a la colonia.La casa de 1 nivel cuenta con:Sala-comedor.Cocina forrada de azulejo y opcion poner barra.1 bano completo forrado de azulejo.2 recamaras ampliasPatio de servicio con proteccion en techo.Cochera para un auto.Amenidades:Construccion tradicional.Cimentacion de piedra, para 2do nivel.Ladrillo.Losa maciza.Boiler instantaneo (ahorro un 40% de gas)Se encuentran en construccion, se entregan completamente terminadas.Forma de pago: Solo pagos de contado.DISPONIBILIDAD Y PRECIO SUJETO A CAMBIOS Y/O VARIACIONES SIN PREVIO AVISO*El precio no incluye gastos de escrituracion, gastos administrativos e impuestos.Horario de atencion para citasLunes a viernes: 10:00 a 14:00 y 16:30 a 18:00Sabados: 10:00 a 14:30Domingos: previa citaMayores informes y citas: 7757533901HAY UN LUGAR ESPERANDO SER TU HOGAR",https://casa.mercadolibre.com.mx/MLM-2122903169-promocion-precio-solo-pago-de-contado-_JM#position%3D8%26search_layout%3Dgrid%26type%3Ditem%26tracking_id%3D9271960c-4ea8-44c2-acdf-5289d69ca8f6
"Preventa Casa En San Jose, Tulancingo Modelo Magnolia",Casa en Venta,Publicado hace 20 dias,Inmobiliaria con identidad verificada,$,"1,100,000",105 m2 totales,3 recamaras,2 banos,2,sin dato,1,sin dato,Si,sin dato,0 anos,"San Jose, Tulancingo De Bravo, Hidalgo","Preventa de casa en Bosques De San Francisco, por su ubicacion en la zona tienes acceso a la carretera federal Mexico-Tuxpan y Pachuca- Tulancingo, servicios de luz, agua, drenaje, internet, transporte publico, a solo 10 minutos del centro de Tulancingo. En 5 minutos llegas a Plaza Patio, donde encontrarastiendas departamentales, bancos de todas las instituciones, MEGA SORIANA, restaurantes, cine, agencias de viajes, Office Depot, etc.Acceso rapido a hospitales y clinicas privadas, hospital veterinario, escuelas publicas y privadas de nivel basico y media superior y a universidades cercanas.-Planta baja:SalaComedorCocina1/2 banoEstacionamiento para un autoPatiode servicio.-Planta alta:Recamara principal con bano completo2 recamaras1 Bano completo-Amenidades:Servicios de vigilanciaÁreas verdesPregunta por la forma de pago.DISPONIBILIDAD Y PRECIO SUJETO A CAMBIOS Y/O VARIACIONES SIN PREVIO AVISO*El precio no incluye gastos de escrituracion, gastos administrativos e impuestos.Horario de atencion para citasLunes a viernes: 10:00 a 14:00 y 16:30 a 18:00Sabados: 10:00 a 14:30Domingos: previa citaMayores informes y citas: 7757533901HAY UN LUGAR ESPERANDO SER TU HOGAR",https://casa.mercadolibre.com.mx/MLM-3281380338-preventa-casa-en-san-jose-tulancingo-modelo-magnolia-_JM#position%3D9%26search_layout%3Dgrid%26type%3Ditem%26tracking_id%3D9271960c-4ea8-44c2-acdf-5289d69ca8f6
"Casa En Venta En Col. La Morena, Tulancingo, Hgo. Cymo",Casa en Venta,Publicado hace 20 dias,Inmobiliaria con identidad verificada,$,"1,148,000",140 m2 totales,3 recamaras,2 banos,2,No,1,No,No,No,15 anos,"De Las Fuentes, La Morena, Tulancingo De Bravo, Hidalgo","¡GRAN OPORTUNIDAD PARA TENER TU CASA PROPIA!Este inmueble es una excelente oportunidad de tener tu vivienda y negocio propio en un solo lugar. Adquiere esta propiedad de recuperacion hipotecaria a un excelente precio y con una inversion inicial de $290,000 pesos. Su ubicacion es ideal en la zona centro de Tulancingo en la Col. Morena, ya que esta cercana a vias de acceso, escuelas, comercios, parques, etc. Si te interesa este inmueble, contactame por este medio y a la brevedad me comunico contigo.Montserrat Hernandez - Asesora Inmobiliaria GACAVA.",https://casa.mercadolibre.com.mx/MLM-3281684678-casa-en-venta-en-col-la-morena-tulancingo-hgo-cymo-_JM#position%3D10%26search_layout%3Dgrid%26type%3Ditem%26tracking_id%3D9271960c-4ea8-44c2-acdf-5289d69ca8f6
"Casa Nueva En Tulancingo, Fracc. La Morenita",Casa en Venta,Publicado hace 11 dias,Inmobiliaria con identidad verificada,$,"1,280,000",101 m2 totales,2 recamaras,1 bano,2,sin dato,2,sin dato,sin dato,sin dato,2 anos,"Santiago Tulantepec, Santiago Tulantepec De Lugo Guerrero, Hidalgo","CASAS NUEVAS EN EL FRACC. LA MORENITALa Morenitaes un fraccionamiento donde tendras la tranquilidad y seguridad que deseas para ti y tu familia. Excelente oportunidad de que ejerzas tu credito.El fraccionamiento se ubica a 5 min. de Santiago Tulantepec y a 10 min. del centro de Tulancingo, en la zona podras encontrartransporte publico a pie de carretera, centros comerciales, salones de fiestas,tiendas, locales, panaderias, internet, tortillerias y Oxxo.La casa cuenta con:Sala.Cocina.Comedor.2 recamaras.1 bano y medio.Patio de servicio.Cuarto de servicio.Cochera para 2 autos.Porton electrico.Interfon.Pregunta por la forma de pago.DISPONIBILIDAD Y PRECIO SUJETO A CAMBIOS Y/O VARIACIONES SIN PREVIO AVISO*El precio no incluye gastos de escrituracion, gastos administrativos e impuestos.Horario de atencion para citasLunes a viernes: 10:00 a 14:00 y 16:30 a 18:00Sabados: 10:00 a 14:30Domingos: previa citaMayores informes y citas: 7757533901HAY UN LUGAR ESPERANDO SER TU HOGAR",https://casa.mercadolibre.com.mx/MLM-3298706626-casa-nueva-en-tulancingo-fracc-la-morenita-_JM#position%3D11%26search_layout%3Dgrid%26type%3Ditem%26tracking_id%3D9271960c-4ea8-44c2-acdf-5289d69ca8f6
"¡¡atencion Gran Oportunidad!! Venta De Amplia Y Linda Casa Con Entrega Inmediata Col. Jardines Del Sur 3era Seccion, Hidalgo.",Casa en Venta,Publicado hace 8 dias,Inmobiliaria con identidad verificada,$,"2,500,000",228.5 m2 totales,4 recamaras,2 banos,2,No,3,No,Si,No,14 anos,"Jardines Del Sur 3ra Seccion, Jardines Del Sur 3a Secc., Tulancingo De Bravo, Hidalgo","¡¡¡Excelente Oportunidad de Inversion a Corto Plazo!!! Aprovecha y adquiere esta hermosa y amplia Casa en Posesion en una de las mejores zonas Tulancingo, MUY por debajo de su valor comercial ya que es parte de un REMATE BANCARIO, no se acepta *****NINGÚN TIPO DE CRÉDITO***** Inicia este sencillo tramite con tan solo: $500,000 y el resto a la firma de la cesion de derechos.Para mayores informes de esta y muchas otras propiedades en la CD.MX. Y Edo. Mex. contactanos.*Horario de Atencion: 9:00 am — 8:00 pm¡Aprovecha y Llama YA!*Fotos ilustrativas.",https://casa.mercadolibre.com.mx/MLM-2118995705-atencion-gran-oportunidad-venta-de-amplia-y-linda-casa-con-entrega-inmediata-col-jardines-del-sur-3era-seccion-hidalgo-_JM#position%3D12%26search_layout%3Dgrid%26type%3Ditem%26tracking_id%3D9271960c-4ea8-44c2-acdf-5289d69ca8f6
"Casa En Privada Residencial, Mod Lugo; Tulancingo Hgo",Casa en Venta,Publicado hace 3 meses,Inmobiliaria con identidad verificada,$,"2,400,000",119 m2 totales,4 recamaras,3 banos,2,sin dato,2,sin dato,sin dato,sin dato,4 anos,"Rancho Nuevo, Tulancingo De Bravo, Hidalgo",El vendedor no incluyo una descripcion del inmueble.,https://casa.mercadolibre.com.mx/MLM-3059447398-casa-en-privada-residencial-mod-lugo-tulancingo-hgo-_JM#position%3D13%26search_layout%3Dgrid%26type%3Ditem%26tracking_id%3D9271960c-4ea8-44c2-acdf-5289d69ca8f6
